{
  "version": 1,
  "plan": {
    "path": ".groundspec/development-plan.json",
    "digest": "a67c2223726c893dcdf05b0e95fcff0e5639b84008c58dbe7a739d3b416a9b17"
  },
  "implementation": {
    "path": ".groundspec/implementation-result.json",
    "digest": "d3c6cad8d61ecd178e3349d848f8e1c84737786016a596011a7d875183d1eb6d"
  },
  "passed": true,
  "commands": [
    {
      "id": "V-01",
      "argv": [
        "go",
        "test",
        "./..."
      ],
      "workingDirectory": ".",
      "exitCode": 0,
      "passed": true,
      "optional": false,
      "log": {
        "path": "test-or-verification/commands/V-01.log",
        "digest": "1d1bbae221b672d84d3f4785e613daf7ba283455eecea36ff84de00d768efce8"
      }
    },
    {
      "id": "V-02",
      "argv": [
        "go",
        "vet",
        "./..."
      ],
      "workingDirectory": ".",
      "exitCode": 0,
      "passed": true,
      "optional": false,
      "log": {
        "path": "test-or-verification/commands/V-02.log",
        "digest": "e3b0c44298fc1c149afbf4c8996fb92427ae41e4649b934ca495991b7852b855"
      }
    },
    {
      "id": "V-03",
      "argv": [
        "go",
        "build",
        "./cmd/groundspec"
      ],
      "workingDirectory": ".",
      "exitCode": 0,
      "passed": true,
      "optional": false,
      "log": {
        "path": "test-or-verification/commands/V-03.log",
        "digest": "e3b0c44298fc1c149afbf4c8996fb92427ae41e4649b934ca495991b7852b855"
      }
    },
    {
      "id": "V-04",
      "argv": [
        "bun",
        "run",
        "scripts/verify-contract-pin.js"
      ],
      "workingDirectory": ".",
      "exitCode": 0,
      "passed": true,
      "optional": false,
      "log": {
        "path": "test-or-verification/commands/V-04.log",
        "digest": "0e239d4a75504c6547d04579589f60ae1d8b717a12e129567d64fc777568a33b"
      }
    },
    {
      "id": "V-05",
      "argv": [
        "bun",
        "run",
        "scripts/contracts-verify.js"
      ],
      "workingDirectory": ".",
      "exitCode": 0,
      "passed": true,
      "optional": false,
      "log": {
        "path": "test-or-verification/commands/V-05.log",
        "digest": "779e1990acac36d8fc59da9da0ff102288cb787e185370ee5d3e6e78661d86ae"
      }
    },
    {
      "id": "V-06",
      "argv": [
        "bun",
        "run",
        "scripts/contracts-impact.smoke.js"
      ],
      "workingDirectory": ".",
      "exitCode": 0,
      "passed": true,
      "optional": false,
      "log": {
        "path": "test-or-verification/commands/V-06.log",
        "digest": "b5b6adc474443050dcaa5afce38bf3358ec3cd94d706dae287220a18a72c8f5e"
      }
    },
    {
      "id": "V-07",
      "argv": [
        "bun",
        "run",
        "scripts/publication-audit.js"
      ],
      "workingDirectory": ".",
      "exitCode": 0,
      "passed": true,
      "optional": false,
      "log": {
        "path": "test-or-verification/commands/V-07.log",
        "digest": "e95912ba26995cb0c37d36707ab76782c5eff067176567ede7a20da7856ca7d2"
      }
    },
    {
      "id": "V-08",
      "argv": [
        "npm",
        "test"
      ],
      "workingDirectory": ".",
      "exitCode": 0,
      "passed": true,
      "optional": false,
      "log": {
        "path": "test-or-verification/commands/V-08.log",
        "digest": "f51b08346e01f86c472782ccd45d220fbdb49f30de14ffd5847987a625b78ee5"
      }
    }
  ],
  "recordedAt": "2026-08-31T22:09:03.229372Z"
}
